{
  "schema_version": "public-candidate-conversion-request-v0",
  "request_class": "preflight_only",
  "objective_item": 9,
  "surface": "public_candidate_conversion",
  "status": "blocked",
  "source_private_record": {
    "domain": "career_private",
    "record_digest": "sha256:aaaaaaaaaaaaaaaaaaaaaaaaaaaaaaaaaaaaaaaaaaaaaaaaaaaaaaaaaaaaaaaa",
    "record_id": "11111111-1111-4111-8111-111111111111",
    "private_retention_consent_id": "22222222-2222-4222-8222-222222222222",
    "private_record_mutation": "forbidden",
    "source_raw_retention": "none",
    "source_retrieval_visible": false
  },
  "new_public_candidate_artifact": {
    "artifact_digest": "sha256:bbbbbbbbbbbbbbbbbbbbbbbbbbbbbbbbbbbbbbbbbbbbbbbbbbbbbbbbbbbbbbbb",
    "payload_digest": "sha256:cccccccccccccccccccccccccccccccccccccccccccccccccccccccccccccccc",
    "domain": "public_experience_candidate",
    "subject_type": "company",
    "claim_type": "subjective_impression",
    "evidence_strength": "single_observation",
    "redaction_level": "public_candidate_safe",
    "raw_source_retention": "none",
    "stored_public_card": false
  },
  "public_candidate_payload": {
    "schema_version": "public-experience-candidate-payload-v0",
    "subject_public_name": "Example Company",
    "redacted_public_candidate_summary": "A public candidate summary keeps only the company name and high-level experience signals while excluding private status, people, dates, and raw messages.",
    "public_observations": [
      "The process cadence felt slower than expected.",
      "The role explanation was useful but operational details were unclear."
    ],
    "public_subjective_impressions": [
      "The experience felt somewhat disorganized from the candidate side."
    ],
    "excluded_private_detail_classes": [
      "submitter_identity",
      "raw_source_material",
      "private_selection_status",
      "staff_identity",
      "raw_review_body",
      "non_public_operational_detail"
    ],
    "source_attribution": "redacted_private_experience_record",
    "publication_state": "candidate_only_not_served"
  },
  "approval_path": {
    "exact_artifact_approval_required": true,
    "reviewer_publish_required": true,
    "consent_challenge_required": true,
    "approval_completed": false,
    "reviewer_publish_completed": false
  },
  "required_gates": [
    "PR-003",
    "PR-005",
    "PR-006",
    "REVIEWER_PUBLISH"
  ],
  "blocked_until": [
    "PR-003",
    "PR-005",
    "PR-006",
    "REVIEWER_PUBLISH"
  ],
  "output_contract": {
    "requested_outputs": [
      "redacted_public_candidate_summary",
      "subject_public_name",
      "claim_type",
      "evidence_strength"
    ],
    "withheld_outputs": [
      "submitter_identity",
      "raw_source_material",
      "private_selection_status",
      "staff_identity",
      "raw_review_body",
      "non_public_operational_detail"
    ]
  },
  "surface_enablement": {
    "conversion_enabled": false,
    "public_serving_enabled": false,
    "b2b_delivery_enabled": false,
    "identity_processing_enabled": false,
    "raw_detail_escrow_enabled": false,
    "dashboard_enabled": false
  },
  "forbidden_outputs": [
    "submitter_identity",
    "raw_source_material",
    "private_selection_status",
    "staff_identity",
    "raw_review_body",
    "non_public_operational_detail"
  ],
  "result_contract": {
    "command_effect": "preflight_only",
    "creates_public_card": false,
    "mutates_private_record": false,
    "opens_public_surface": false,
    "delivers_to_b2b": false,
    "serves_dashboard": false,
    "stores_raw_detail": false
  }
}
